2025-11-06 21:44:17,457 - INFO - 
################################################################################
2025-11-06 21:44:17,457 - INFO - Starting MenuMiner Pro - Scraping 15 websites
2025-11-06 21:44:17,458 - INFO - ################################################################################

2025-11-06 21:44:17,459 - INFO - 
================================================================================
2025-11-06 21:44:17,460 - INFO - Scraping: https://buffer.com
2025-11-06 21:44:17,460 - INFO - 
================================================================================
2025-11-06 21:44:17,460 - INFO - ================================================================================
2025-11-06 21:44:17,461 - INFO - 
================================================================================
2025-11-06 21:44:17,461 - INFO - 
================================================================================
2025-11-06 21:44:17,461 - INFO - Scraping: https://mailchimp.com
2025-11-06 21:44:17,461 - INFO - 
================================================================================
2025-11-06 21:44:17,463 - INFO - Scraping: https://hootsuite.com
2025-11-06 21:44:17,463 - INFO - Scraping: https://www.activecampaign.com
2025-11-06 21:44:17,464 - INFO - ================================================================================
2025-11-06 21:44:17,464 - INFO - Scraping: https://www.hubspot.com
2025-11-06 21:44:17,465 - INFO - ================================================================================
2025-11-06 21:44:17,465 - INFO - ================================================================================
2025-11-06 21:44:17,466 - INFO - ================================================================================
2025-11-06 21:44:17,725 - INFO - Starting extraction for https://mailchimp.com
2025-11-06 21:44:17,725 - INFO - Trying strategy: ARIA-based
2025-11-06 21:44:17,861 - INFO - Starting extraction for https://www.activecampaign.com
2025-11-06 21:44:17,873 - INFO - Trying strategy: ARIA-based
2025-11-06 21:44:17,899 - INFO - Starting extraction for https://buffer.com
2025-11-06 21:44:18,029 - INFO - Trying strategy: ARIA-based
2025-11-06 21:44:18,189 - INFO - Trying strategy: Semantic-based
2025-11-06 21:44:18,212 - INFO - Trying strategy: Pattern-based
2025-11-06 21:44:18,311 - INFO - 
================================================================================
2025-11-06 21:44:18,321 - INFO - 
================================================================================
2025-11-06 21:44:18,322 - INFO - Scraping: https://www.slack.com
2025-11-06 21:44:18,328 - INFO - Scraping: https://www.shopify.com
2025-11-06 21:44:18,328 - INFO - ================================================================================
2025-11-06 21:44:18,333 - INFO - 
================================================================================
2025-11-06 21:44:18,334 - INFO - ================================================================================
2025-11-06 21:44:18,335 - INFO - Scraping: https://www.figma.com
2025-11-06 21:44:18,337 - INFO - ================================================================================
2025-11-06 21:44:18,401 - INFO - Starting extraction for https://hootsuite.com
2025-11-06 21:44:18,401 - INFO - Trying strategy: ARIA-based
2025-11-06 21:44:18,465 - INFO - Trying strategy: Semantic-based
2025-11-06 21:44:18,494 - INFO - 
================================================================================
2025-11-06 21:44:18,494 - INFO - Scraping: https://www.airtable.com
2025-11-06 21:44:18,495 - INFO - ================================================================================
2025-11-06 21:44:18,611 - INFO - Starting extraction for https://www.shopify.com
2025-11-06 21:44:18,611 - INFO - Trying strategy: ARIA-based
2025-11-06 21:44:18,739 - INFO - Trying strategy: Semantic-based
2025-11-06 21:44:18,746 - INFO - Trying strategy: Pattern-based
2025-11-06 21:44:18,910 - INFO - 
================================================================================
2025-11-06 21:44:18,910 - INFO - Scraping: https://www.asana.com
2025-11-06 21:44:18,910 - INFO - ================================================================================
2025-11-06 21:44:19,304 - INFO - Starting extraction for https://www.figma.com
2025-11-06 21:44:19,305 - INFO - Trying strategy: ARIA-based
2025-11-06 21:44:19,356 - INFO - Trying strategy: Semantic-based
2025-11-06 21:44:19,360 - INFO - Trying strategy: Pattern-based
2025-11-06 21:44:19,428 - INFO - Starting extraction for https://www.slack.com
2025-11-06 21:44:19,436 - INFO - Trying strategy: ARIA-based
2025-11-06 21:44:19,577 - INFO - Trying strategy: Semantic-based
2025-11-06 21:44:19,635 - INFO - Starting extraction for https://www.asana.com
2025-11-06 21:44:19,648 - INFO - Trying strategy: Pattern-based
2025-11-06 21:44:19,650 - INFO - Trying strategy: ARIA-based
2025-11-06 21:44:19,771 - INFO - Trying strategy: Semantic-based
2025-11-06 21:44:19,792 - INFO - Trying strategy: Visual-based
2025-11-06 21:44:19,807 - INFO - Trying strategy: Pattern-based
2025-11-06 21:44:20,051 - INFO - 
================================================================================
2025-11-06 21:44:20,135 - INFO - Trying strategy: Visual-based
2025-11-06 21:44:20,141 - INFO - Scraping: https://www.notion.so
2025-11-06 21:44:20,240 - INFO - ================================================================================
2025-11-06 21:44:20,466 - INFO - Starting extraction for https://www.airtable.com
2025-11-06 21:44:20,473 - INFO - Trying strategy: ARIA-based
2025-11-06 21:44:20,498 - INFO - 
================================================================================
2025-11-06 21:44:20,681 - INFO - Scraping: https://www.canva.com
2025-11-06 21:44:20,692 - INFO - 
================================================================================
2025-11-06 21:44:20,692 - INFO - ================================================================================
2025-11-06 21:44:20,702 - INFO - Scraping: https://www.dropbox.com
2025-11-06 21:44:20,708 - INFO - 
================================================================================
2025-11-06 21:44:20,708 - INFO - ================================================================================
2025-11-06 21:44:20,708 - INFO - Scraping: https://www.trello.com
2025-11-06 21:44:20,708 - INFO - ================================================================================
2025-11-06 21:44:21,043 - INFO - Starting extraction for https://www.hubspot.com
2025-11-06 21:44:21,043 - INFO - Trying strategy: ARIA-based
2025-11-06 21:44:21,272 - INFO - Starting extraction for https://www.notion.so
2025-11-06 21:44:21,274 - INFO - Trying strategy: ARIA-based
2025-11-06 21:44:21,316 - INFO - Trying strategy: Semantic-based
2025-11-06 21:44:21,380 - INFO - 
================================================================================
2025-11-06 21:44:21,389 - INFO - Scraping: https://www.zendesk.com
2025-11-06 21:44:21,391 - INFO - ================================================================================
2025-11-06 21:44:21,579 - INFO - Starting extraction for https://www.zendesk.com
2025-11-06 21:44:21,579 - INFO - Trying strategy: ARIA-based
2025-11-06 21:44:21,680 - INFO - Trying strategy: Semantic-based
2025-11-06 21:44:21,706 - INFO - Trying strategy: Pattern-based
2025-11-06 21:44:21,739 - INFO - Starting extraction for https://www.trello.com
2025-11-06 21:44:21,763 - INFO - Trying strategy: ARIA-based
2025-11-06 21:44:21,864 - INFO - Trying strategy: Semantic-based
2025-11-06 21:44:21,884 - INFO - Trying strategy: Pattern-based
2025-11-06 21:44:21,938 - INFO - Trying strategy: Visual-based
2025-11-06 21:44:22,082 - INFO - Starting extraction for https://www.dropbox.com
2025-11-06 21:44:22,082 - WARNING - Fetch attempt 1 failed for https://www.canva.com: 403 Client Error: Forbidden for url: https://www.canva.com/
2025-11-06 21:44:22,088 - INFO - Trying strategy: ARIA-based
2025-11-06 21:44:22,173 - INFO - Trying strategy: Semantic-based
2025-11-06 21:44:24,212 - WARNING - Fetch attempt 2 failed for https://www.canva.com: 403 Client Error: Forbidden for url: https://www.canva.com/
2025-11-06 21:44:28,361 - WARNING - Fetch attempt 3 failed for https://www.canva.com: 403 Client Error: Forbidden for url: https://www.canva.com/
2025-11-06 21:44:28,362 - ERROR - Failed to fetch https://www.canva.com after 3 attempts
2025-11-06 21:44:28,379 - INFO - 
================================================================================
2025-11-06 21:44:28,379 - INFO - SCRAPING SUMMARY
2025-11-06 21:44:28,380 - INFO - ================================================================================
2025-11-06 21:44:28,380 - INFO - Total Sites: 15
2025-11-06 21:44:28,390 - INFO - 
Total Menus Extracted: 288
2025-11-06 21:44:28,390 - INFO - Total Menu Items: 3133
2025-11-06 21:44:28,391 - INFO - Average Time per Site: 1.50s
2025-11-06 21:44:28,392 - INFO - 
Extraction Methods Used:
2025-11-06 21:44:28,392 - INFO -   - ARIA-based: 4 sites
2025-11-06 21:44:28,393 - INFO -   - Pattern-based: 4 sites
2025-11-06 21:44:28,393 - INFO -   - Semantic-based: 3 sites
2025-11-06 21:44:28,393 - INFO -   - Visual-based: 3 sites
2025-11-06 21:44:28,394 - INFO - 
Failed Sites:
2025-11-06 21:44:28,399 - INFO - ================================================================================

2025-11-06 21:46:43,221 - INFO - 
################################################################################
2025-11-06 21:46:43,221 - INFO - Starting MenuMiner Pro - Scraping 15 websites
2025-11-06 21:46:43,221 - INFO - ################################################################################

2025-11-06 21:46:43,221 - INFO - 
================================================================================
2025-11-06 21:46:43,221 - INFO - 
================================================================================
2025-11-06 21:46:43,221 - INFO - Scraping: https://buffer.com
2025-11-06 21:46:43,221 - INFO - 
================================================================================
2025-11-06 21:46:43,221 - INFO - 
================================================================================
2025-11-06 21:46:43,221 - INFO - Scraping: https://mailchimp.com
2025-11-06 21:46:43,221 - INFO - 
================================================================================
2025-11-06 21:46:43,225 - INFO - ================================================================================
2025-11-06 21:46:43,225 - INFO - Scraping: https://hootsuite.com
2025-11-06 21:46:43,225 - INFO - Scraping: https://www.activecampaign.com
2025-11-06 21:46:43,225 - INFO - ================================================================================
2025-11-06 21:46:43,225 - INFO - Scraping: https://www.hubspot.com
2025-11-06 21:46:43,225 - INFO - ================================================================================
2025-11-06 21:46:43,225 - INFO - ================================================================================
2025-11-06 21:46:43,225 - INFO - ================================================================================
2025-11-06 21:46:43,347 - INFO - Starting extraction for https://buffer.com
2025-11-06 21:46:43,351 - INFO - Trying strategy: ARIA-based
2025-11-06 21:46:43,400 - INFO - Trying strategy: Semantic-based
2025-11-06 21:46:43,404 - INFO - Trying strategy: Pattern-based
2025-11-06 21:46:43,584 - INFO - Starting extraction for https://mailchimp.com
2025-11-06 21:46:43,641 - INFO - Starting extraction for https://www.activecampaign.com
2025-11-06 21:46:43,645 - INFO - Trying strategy: ARIA-based
2025-11-06 21:46:43,645 - INFO - Trying strategy: ARIA-based
2025-11-06 21:46:44,063 - INFO - 
================================================================================
2025-11-06 21:46:44,076 - INFO - Scraping: https://www.slack.com
2025-11-06 21:46:44,080 - INFO - 
================================================================================
2025-11-06 21:46:44,088 - INFO - 
================================================================================
2025-11-06 21:46:44,088 - INFO - ================================================================================
2025-11-06 21:46:44,088 - INFO - Scraping: https://www.shopify.com
2025-11-06 21:46:44,088 - INFO - Scraping: https://www.figma.com
2025-11-06 21:46:44,088 - INFO - ================================================================================
2025-11-06 21:46:44,092 - INFO - ================================================================================
2025-11-06 21:46:44,217 - INFO - Starting extraction for https://hootsuite.com
2025-11-06 21:46:44,217 - INFO - Trying strategy: ARIA-based
2025-11-06 21:46:44,281 - INFO - Trying strategy: Semantic-based
2025-11-06 21:46:44,366 - INFO - Starting extraction for https://www.shopify.com
2025-11-06 21:46:44,370 - INFO - Trying strategy: ARIA-based
2025-11-06 21:46:44,480 - INFO - Trying strategy: Semantic-based
2025-11-06 21:46:44,492 - INFO - Trying strategy: Pattern-based
2025-11-06 21:46:44,500 - INFO - 
================================================================================
2025-11-06 21:46:44,524 - INFO - Scraping: https://www.airtable.com
2025-11-06 21:46:44,552 - INFO - ================================================================================
2025-11-06 21:46:44,656 - INFO - 
================================================================================
2025-11-06 21:46:44,656 - INFO - Scraping: https://www.asana.com
2025-11-06 21:46:44,656 - INFO - ================================================================================
2025-11-06 21:46:45,235 - INFO - Starting extraction for https://www.slack.com
2025-11-06 21:46:45,235 - INFO - Trying strategy: ARIA-based
2025-11-06 21:46:45,295 - INFO - Trying strategy: Semantic-based
2025-11-06 21:46:45,307 - INFO - Trying strategy: Pattern-based
2025-11-06 21:46:45,386 - INFO - Trying strategy: Visual-based
2025-11-06 21:46:45,515 - INFO - Starting extraction for https://www.figma.com
2025-11-06 21:46:45,527 - INFO - Trying strategy: ARIA-based
2025-11-06 21:46:45,620 - INFO - Trying strategy: Semantic-based
2025-11-06 21:46:45,645 - INFO - Trying strategy: Pattern-based
2025-11-06 21:46:45,926 - INFO - Starting extraction for https://www.asana.com
2025-11-06 21:46:46,041 - INFO - Starting extraction for https://www.hubspot.com
2025-11-06 21:46:46,043 - INFO - Trying strategy: ARIA-based
2025-11-06 21:46:46,065 - INFO - Trying strategy: ARIA-based
2025-11-06 21:46:46,132 - INFO - Trying strategy: Semantic-based
2025-11-06 21:46:46,140 - INFO - 
================================================================================
2025-11-06 21:46:46,275 - INFO - Trying strategy: Pattern-based
2025-11-06 21:46:46,340 - INFO - 
================================================================================
2025-11-06 21:46:46,344 - INFO - Scraping: https://www.notion.so
2025-11-06 21:46:46,443 - INFO - Trying strategy: Visual-based
2025-11-06 21:46:46,447 - INFO - Scraping: https://www.canva.com
2025-11-06 21:46:46,447 - INFO - ================================================================================
2025-11-06 21:46:46,498 - INFO - ================================================================================
2025-11-06 21:46:46,756 - INFO - 
================================================================================
2025-11-06 21:46:46,760 - INFO - Scraping: https://www.dropbox.com
2025-11-06 21:46:46,764 - INFO - 
================================================================================
2025-11-06 21:46:46,764 - INFO - ================================================================================
2025-11-06 21:46:46,768 - INFO - Scraping: https://www.trello.com
2025-11-06 21:46:46,768 - INFO - ================================================================================
2025-11-06 21:46:47,289 - INFO - Starting extraction for https://www.notion.so
2025-11-06 21:46:47,293 - INFO - Trying strategy: ARIA-based
2025-11-06 21:46:47,360 - INFO - Trying strategy: Semantic-based
2025-11-06 21:46:47,360 - INFO - Starting extraction for https://www.trello.com
2025-11-06 21:46:47,385 - INFO - Trying strategy: ARIA-based
2025-11-06 21:46:47,419 - INFO - Trying strategy: Semantic-based
2025-11-06 21:46:47,431 - INFO - Trying strategy: Pattern-based
2025-11-06 21:46:47,483 - INFO - Trying strategy: Visual-based
2025-11-06 21:46:47,583 - INFO - 
================================================================================
2025-11-06 21:46:47,592 - INFO - Scraping: https://www.zendesk.com
2025-11-06 21:46:47,592 - INFO - ================================================================================
2025-11-06 21:46:47,698 - WARNING - Fetch attempt 1 failed for https://www.canva.com: 403 Client Error: Forbidden for url: https://www.canva.com/
2025-11-06 21:46:47,798 - INFO - Starting extraction for https://www.zendesk.com
2025-11-06 21:46:47,798 - INFO - Trying strategy: ARIA-based
2025-11-06 21:46:47,871 - INFO - Trying strategy: Semantic-based
2025-11-06 21:46:47,903 - INFO - Trying strategy: Pattern-based
2025-11-06 21:46:47,923 - INFO - Starting extraction for https://www.airtable.com
2025-11-06 21:46:47,935 - INFO - Trying strategy: ARIA-based
2025-11-06 21:46:48,244 - INFO - Starting extraction for https://www.dropbox.com
2025-11-06 21:46:48,253 - INFO - Trying strategy: ARIA-based
2025-11-06 21:46:48,334 - INFO - Trying strategy: Semantic-based
2025-11-06 21:46:49,876 - WARNING - Fetch attempt 2 failed for https://www.canva.com: 403 Client Error: Forbidden for url: https://www.canva.com/
2025-11-06 21:46:54,233 - WARNING - Fetch attempt 3 failed for https://www.canva.com: 403 Client Error: Forbidden for url: https://www.canva.com/
2025-11-06 21:46:54,237 - ERROR - Failed to fetch https://www.canva.com after 3 attempts
2025-11-06 21:46:54,254 - INFO - 
================================================================================
2025-11-06 21:46:54,254 - INFO - SCRAPING SUMMARY
2025-11-06 21:46:54,254 - INFO - ================================================================================
2025-11-06 21:46:54,254 - INFO - Total Sites: 15
2025-11-06 21:46:54,267 - INFO - 
Total Menus Extracted: 287
2025-11-06 21:46:54,271 - INFO - Total Menu Items: 3131
2025-11-06 21:46:54,271 - INFO - Average Time per Site: 1.62s
2025-11-06 21:46:54,271 - INFO - 
Extraction Methods Used:
2025-11-06 21:46:54,271 - INFO -   - Pattern-based: 4 sites
2025-11-06 21:46:54,271 - INFO -   - ARIA-based: 4 sites
2025-11-06 21:46:54,271 - INFO -   - Semantic-based: 3 sites
2025-11-06 21:46:54,275 - INFO -   - Visual-based: 3 sites
2025-11-06 21:46:54,275 - INFO - 
Failed Sites:
2025-11-06 21:46:54,279 - INFO - ================================================================================

